{
  "schema_version": 1,
  "root_id": "project",
  "compasses": [
    {
      "id": "project",
      "kind": "root",
      "path": "contract.json",
      "parent_id": null,
      "status": "active"
    },
    {
      "id": "compass-foundation",
      "kind": "subsystem",
      "path": "compasses/compass-foundation.json",
      "parent_id": "project",
      "status": "active"
    }
  ],
  "links": [],
  "updated_at": "2026-08-14T23:11:30.026Z"
}
